"","book","reviewer","rating","review"
"73","Wuthering Heights"," 21, 2015 Julie","really liked it"," It was hard not to compare this book to Jane Eyre, for the simple reason that these are both classics written by sisters. I had put both off for years thinking they would be too much of a challenge, and after finally reading JE earlier this year, and ranking it a top favorite of all time, I knew I wanted to read WH and am so glad I did. I don t think the two novels can even be compared, and what I enjoyed about this one was not having read the blurb going in.It was a challenging read at times, due to the naming of the numerous characters that were almost impossible for me to keep track of without the use of a family tree Everything about this book is dark and dismal. The unlikable and selfish characters that were perfect for each other make irrational decisions, and the story evolves around a relationship that is developed out of spite, and will affect the next generation of families as well. It made me wonder more about the author and what inspired her to write a book about such a dysfunctional family, especially given the time it was written. The story is not so much a love story as it is one of passion and obsession. It was an absorbing read, and one that I am still processing, mostly, regarding whether the character Heathcliff was sympathetic. For all his actions of hatred and revenge, I can t help but wonder if he is sympathetic for all the suffering, scarring, and torment he endured. I loved the way his character was developed in spite of his evil traits. I think this is a book that is either loved or hated but if you like gothic romance, the moors, a touch of the paranormal, and even reading about dysfunctional families and unlikable characters, this classic is well worth the read. "
"74","Wuthering Heights"," 23, 2015 helen the bookowl","really liked it"," This was a reread for me, and I was astonished at how much I had forgotten. I love the fact that this story is written like a story within a story, and I love how we get to follow the main characters from they re little children till the last years of their lives. You would assume that would make them more lovable to the reader since we get to follow them through everything, but NO I m still puzzled as to how I feel about Catherine and Heathcliff. They are both so nasty and selfish, but at the same time it ached my heart to hear of Heathcliff s destiny in the end. I love the fact that Emily Bront plays with her hero and hero ne in such a way she manages to makes them unlovable as well as loveable and I don t know how This is a victorian novel and I think it reads best during autumn. I was at times confused at all the characters and their names Emily Bront oftentimes calls her characters by first their last name, then their first name. I was also frustrated by the fact that I didn t understand a word of what Joseph said. But all in all, this is a masterpiece that plays with your mind and makes you wonder what makes a character lovable or unlovable "
"75","Wuthering Heights"," 22, 2015 Elham Kharidar","really liked it"," Dear reader who hasn t read Whuthering Heights yet,It is not a love story. It is a horrible epic. The love of Heathcliff for Catherine is one of the most destructive passions that one can see in literature. Heathcliff who could do anything for his love can be a symbol of greedy and senseless people who are ready to victimize everything and everybody for their certain goals. In this novel hatred and inferiority complex are at their maximum level. One sided judgment and cruelty over people have their most appealing reason Love. One thing that made this novel very much readable is the power of the author herself to show these negative but humanly weak points in a very strong style that makes Heathcliff an unforgettable character. The next time you find yourself in the stage of being self centered and unfair about other people remember Heathcliff. But be careful that he was a blind lover whilst for most of our irrationalities we are not lovers "
"76","Wuthering Heights"," 16, 2011 KatLynne","it was amazing"," Finished my re read today and what I had forgotten about this novel is brilliance . How often do we find an author who can make your heart bleed with tenderness and compassion for a character while only a few chapters later, your greatest desire is to thrash said character in the throes of anger. And the remarkable thing is that while you are wanting to hurt him in some measure to convey your dislike for his dastardly deeds, still inside and trying to lure its way to the forefront of your emotion is the initial tenderness and compassion. Does that make any sense at all Wuthering Heights is a tale of despair, revenge and of love. It is a Gothic novel. Knowing this going in, I still had forgotten the extent of the darkness and how much despair fill its pages. It follows the life of orphaned Heathcliff and his adoptive family the Earnshaws and his revenge against the two families the Earnshaws Lintons who have wronged him and his love hate relationship with Catherine Earnshaw. And make no mistake that these two do love each other and often, hatred and anger is temporarily their emotion of choice. At this point of the review, we could stop and expound on all the many elements or merits of the underlying themes meanings found. We could spend many paragraphs pages discussing the brilliance there s that word again by this author s use of the calendar and lunar phases to mark the passage of time or her great knowledge and use of the law to achieve certain objectives. We could even bring forth some of the many questions put about since its publication ..Did Heathcliff and Catherine love each other as man wife or more like twins ...Do we know for sure that Heathcliff was not the biological son of Catherine s father, Mr. Earnshaw ...there are so many But in this review, it is simply my love hate relationship with this book and a brief summary of my thoughts. The story takes place between Wuthering Heights, a remote moorland farmhouse belonging to the generations of Earnshaws and Thrushcross Grange, a beautiful mansion owned through the generations of the Lintons, both located in a remote corner of West Yorkshire. The story is told through the housekeeper, Mrs. Ellen Dean. She is relaying the facts to Mr. Lockwood, a recent tenant of Thrushcross Grange. And the characters are only those related in these two families, with very few outside included. WH follows two generations. The novel begins with Mr. Mrs. Earnshaw and their children, Hindley Catherine. Heathcliff is brought into the Earnshaw home by Mr. Earnshaw, who while visiting London found him homeless, about seven years old and living on the streets. Having pity on this dirty, hungry bedraggled gypsy looking boy, he brings him into the Earnshaw fold and treats him like one of his children. Later on, this creates such animosity between Earnshaw s son, Hindley that his future treatment of Heathcliff is nearly unforgivable. And hatred is born in Heathcliff that will only be released through revenge.We soon meet the other family involved in this story. The Linton s along with their children, Edgar Isabella. Mr. Mrs. Earnshaw have both died and now Hindley Earnshaw is in charge of the household. His hatred for Heathcliff is no secret and he bans him from any family activity. He cannot eat or play with Catherine. Hindley intends to show Heathcliff that his place is as a servant and not a family member. Heath is mistreated and shamed often. The anguish and grief this causes Heathcliff and Catherine is palpable. Edgar Linton is the exact opposite of Heathcliff pale skin, refined, scholarly rich and from a prominent family. Both The Linton s and Hindley feel a good match would be made between Edgar and Catherine. One evening, after overhearing a conversation by Catherine, Heathcliff s very soul seems crushed and he is filled with shame. Heathcliff now realizes that he doesn t measure up to society s standards he s not good enough or clean enough not rich enough and not scholarly enough. We are dumped into the depths of Heath s despair and hatred. Crushed with hurt, he leaves Wuthering Heights, returning a few years later, more educated, refined and also rich. Catherine has made choices she now regrets or that has brought consequences she did not foresee. Both Heath s and Catherine s hearts and spirit will be broken. Despair is encapsulated on every page Heartache follows. There is death. Despair Cruelty And in the midst of great pain and torment, Heathcliff never looses sight of revenge. And now Edgar Linton is added to his destructive path. And maybe his heartache was so great, he needed this focus to face each day. Heathcliff s revenge will seek its completion with the next generation Cathy Linton Hareton Earnshaw and Linton Heathcliff. Isabella Linton is used and discarded without a blink or a thought of remorse. Heathcliff s decision to cause pain and exact his revenge on his enemies and their children is the focus of his days. And this is the life and goal for Heath for many,many years. Now, his goal is in sight total revenge is at hand. And then a remarkable thing happens and revenge doesn t seem to be his mainstay. Something or someone is drawing him away from his cruelty and his focus is diverted. He cannot eat nor sleep. Whether in the moors or at home, it s as if he is searching .and seeing .What could it be and is it enough to stop the destructive path of revenge to end his days of anguish to stop the heart wrenching despair and loneliness Will a reprieve be had and allow the last of the Earnshaw s and the last of the Linton s to unite A hauntingly, brilliant, passionate love story full of obsession, despair, and revenge that draws you into the heart, keeps you there, and when done, never to forget Heathcliff or Catherine s story. And this is why I state I have a love hate relationship with this novel. I have used the word despair often in this review. For me, it s the underlying theme word. I dislike Gothic novels, but I loved this one I hate despair, but I could not stop reading this one I hated Heathcliff, but I loved him so very much also A brilliant work Memoriable Quote view spoiler May she wake in torment he cried, with frightful vehemence, stamping his foot, and groaning in a sudden paroxysm of ungovernable passion. Why, she s a liar to the end Where is she Not there not in heaven not perished where Oh you said you cared nothing for my sufferings And I pray one prayer I repeat it till my tongue stiffens Catherine Earnshaw, may you not rest as long as I am living you said I killed you haunt me, then The murdered do haunt their murderers, I believe. I know that ghosts have wandered on earth. Be with me always take any form drive me mad only do not leave me in this abyss, where I cannot find you Oh, God it is unutterable I cannot live without my life I cannot live without my soul hide spoiler "
"77","Wuthering Heights"," 01, 2016 Waqas","it was amazing"," This is so irrelevant to the book. view spoiler The pristine thorns of love unfurl the tragedies inherent in us as they make us bleed, and remain aloft with their pride and superstition. The intensity of holding the fluttering emotions is so still as a stagnant water which is ever so prone to drowning our oblique existence fluctuating between the ecstasy and torment. Absurdity wraps itself in silky illusions when our insatiable impulses are satiated by the supernatural repose churning in the pools of a heart ablaze with infatuation each spark ensuing the cold kiss of frosty separation, each flame extinguished in the rueful tempest. Yet this ignition never flares.She never told her loveBut let concealment, like worm i the bud,Feed on her damask cheek How we shrunk beholding the rearing loftiness of Wuthering Heights catering our fears with its latched doors guarding the slumbering secrets of past and future like the Janus, and smoldering walls hiding the passions too immense, vengeances perpetually intoxicated, and sufferings increasingly augmented all of it further escalated by our prejudiced curiosity. Franz Liszt once described Beethoven s delicate second movement of Moonlight Sonata as a flower between two chasms , which inculcates a striking harmony with the feisty Catherine s episode, the daughter, blooming between the haunting memories and impending chaos that will completely change her life. A chaos of Catherine s love for Heathcliff, which singles out our every possible infatuation, and infantilizes them into demure sleet trickling away beneath their seething footsteps of love. Can we follow them with our marginal sustainability We too fragile to endure, this chilly wind over moorlands and heath. Though Earth and Moon were goneAnd suns and universe ceased to beAnd thou were left aloneEvery existence would exist in thee Relinquishing the grasp of reality, attaining one in the superstition of death the embers in the hearth his only warmth, and the whole world becomes a black void of oblivion as it shimmered as the pupil of his eye. Heathcliff s soul turns into steel. Brittle with pain and sufferings, opaque towards the any perception of worldly mitigation. The endless deferral of solace insinuates in him the ambiance of obsession and cruelty impregnating the fantasies replete with impossible. The juxtaposition of dreams and reality, the wild and tender, and of his emotions in chaos against the solid composure of his body, delineate the dissonance of clashing notions never meant to reconcile but always remaining in limbo for their fatalistic yearning of harmonization. Sleep brings no joy to meRemembrance never diesMy only wish is to forgetIn the sleep of death The rebellion for a transcendent peace and its impending attainment pulsate throughout the story the fugitive summers are idealized in the perpetual winters, transforming the earthly bliss into celestial sanctuaries, the song of lark echoing a heavenly lullaby, dismantled senses assuaged by the vestiges of childhood. A mad impulse constantly propelled to parish oneself in the soothing soil, to cut off Ariadne s thread with scorn, to destroy one s own flesh so incapable of encompassing the sufferings and joys inherent, for any mortal outlet has shrunk too narrow for the astronomical ecstasies to escape. An endless delirium for salvation augmented by the imprisonment of insatiable, frustrated, demonic soul. A collision of disenchantment and idealization her idea of Heathchilf becomes too remote and divine, too hers to be held in her defiled existence. And their legend continue to haunt those who roam the wild moorlands of Wuthering Heights, who curl in the despair of solitude and thumb these pages with great delight. Emily Bront The Complete Poems hide spoiler "
"78","Wuthering Heights"," 29, 2016 Laurie A Court of Books","really liked it"," Actual Rating 4.2B.R avec l adorable JonnieSo glad I finally decided to read this book If all else perished, and he remained, I should still continue to be and if all else remained, and he were annihilated, the universe would turn to a mighty stranger. I didn t expected to hate and love so much those characters. Well, at first I thought that I would adore them. And then I ended up resenting them, wondering how I even wanted their happiness in the first place. But I ended up with a glint of tenderness for both of them while closing the last page.Catherine Earnshaw and Heathcliff are the two most flawed character I have ever read about. They are selfish, mean to everyone even each other , vain, childish and so many more flaws. They first met when Catherine s father adopt Heathcliff. He stayed a long time in the streets and don t really know how to behave in society, he is dirty and not well educated. Catherine takes little time before considering him as family but her brother, Hindley Earnshaw feels so superior. He treats Heathcliff like a slumdog and has never been once polite to him. My love for Heathcliff resembles the eternal rocks beneath a source of little visible delight, but necessary. Catherine and Heathcliff are both young, around the same age, and they grow up together. I often pictured them like dogs in my mind, especially in their childhood. They fight a lot literally in the mud most of the time , but they are very loyal to each other, like if no one can bother the other but him herself.While growing up, they are randomly and alternatively hopelessly in love and full of hatred toward the other. It was really hard to follow sometimes. I think that they mostly love each other, but they know they are not supposed to, and they also don t know how to express it properly. That is how they end up being so mean. Despite the fact that they both act like animals and they are equally mean, they don t end up with the same future. Catherine marries the well educated, smart Edgar Linton while Heathcliff runs away. I think that Edgar Linton was the nicest character of them all, I really gotten fond of him, he was so full of love and respect for Catherine both of them actually . He was selfless and took the best care possible of his girls. He was patient and tired to understand Catherine without judgments. Emily Bront really knows how to write, that is for sure, she know how to be true and faithful to her characters defaults, but making us liking them nonetheless.I don t think I need to develop a lot on this book, whoever haven t read it yet, you just definitely should. "
"79","Wuthering Heights"," 01, 2012 Forrest","it was amazing"," This review has been hidden because it contains spoilers. To view it, click here. Spoiler Warning It s difficult to comment on such a classic without sounding trite. I have to say, though, that I find Heathcliff to be one of the most compelling characters out there. I didn t find him immediately evil and, in fact, I rather felt for the guy up until he gets physical with his soon to be daughter in law. Those intense feelings of jealousy and consternation over the ambiguities of his friend love, as well as the injured sense of justice that he holds honestly, I ve felt all t Spoiler Warning It s difficult to comment on such a classic without sounding trite. I have to say, though, that I find Heathcliff to be one of the most compelling characters out there. I didn t find him immediately evil and, in fact, I rather felt for the guy up until he gets physical with his soon to be daughter in law. Those intense feelings of jealousy and consternation over the ambiguities of his friend love, as well as the injured sense of justice that he holds honestly, I ve felt all those things rather deeply, at times more particularly in my teenage years . I felt a great deal of sympathy for the man.Then things suddenly went wrong. His manipulations of conversations, others weaknesses, and legalities I can understand, though I myself would never use such tactics. But when he gets downright physically abusive, he crossed the line from emo with a cause to bullying jerk. Suddenly, I found myself despising the man.In the end, though, I again found myself sympathetic to his madness. The obsession and drive that kept him alive, yearning, and reaching for his Catherine were qualities to be admired, to some degree, though with eyes averted enough that onlookers won t think that they are being admired. I found it fitting that this same drive pushed him closer and closer to the death he secretly welcomed. The closer he came to seeing Catherine again, the closer he came to death, and the happier he was. Heathcliff was everything an emo aspires to, always reaching for the unattainable and only satisfied when dying in the process.Yes, there are a plethora of other characters, each with their own complexity I am a particular fan of Catherine Earnshaw, a marvelously complex person , but the real action, the real driver behind it all is Heathcliff. Love him or hate him or vacillate back and forth like I did , he is the engine behind the plot and forms the other characters sometimes by carving through them .As far as the writing goes, it s Victorian writing overwrought, purple, baroque, at times tedious, at times brilliant. My only complaint was the insistence on phonetically spelling out some of the thicker Yorkshire accents. This became a little over the top and I found myself skimming whenever Joseph spoke. And there s that self righteous Nelly. Argh. If I had Nelly nagging me and preachifying all the time I might just find myself digging up the body of my dead former girlfriend and . . . well, that explains a whole lot, doesn t it "
"80","Wuthering Heights"," 27, 2016 Mimi","really liked it"," Liked it much better this time around mostly because I chose to read it for a book club , not because it was forced on me as a school assignment.Back then, I didn t or maybe couldn t appreciate the sweeping nature of Emily Bronte s use of language, but now I like it. She painted countryside scenery so very well, and she did the same with extreme characterization. I could read whole books about the wilderness and the moors and cliffs and crags of Wuthering Heights. The land on which the estate sat was painted with sweeping language as well, but with a haunting overtone. The scenery overall is beautifully rendered, and the characters and their relationships too, though tragically so. I think it was this book that made me first realize I had an intense appreciation for stories that don t end well, and the intensity of Bronte s language makes experiencing her creation a deeply visceral albeit somewhat satisfying, somewhat disturbing journey. I cannot express it but surely you and everybody have a notion that there is or should be an existence of yours beyond you. What were the use of my creation, if I were entirely contained here My great miseries in this world have been Heathcliff s miseries, and I watched and felt each from the beginning my great thought in living is himself. If all else perished, and he remained, I should still continue to be and if all else remained, and he were annihilated, the universe would turn to a mighty stranger I should not seem a part of it. My love for Linton is like the foliage in the woods time will change it, I m well aware, as winter changes the trees. My love for Heathcliff resembles the eternal rocks beneath a source of little visible delight, but necessary. Nelly, I am Heathcliff He s always, always in my mind not as a pleasure, any more than I am always a pleasure to myself, but as my own being. "
"81","Wuthering Heights"," 31, 2016 Scarlet","really liked it"," A passionate hate story that is supremely compelling to read."
