"","book","reviewer","rating","review"
"30","Wuthering Heights"," 09, 2016 Stacey prettybooks","liked it"," This post is part of the 2015 Classics Challenge. Spoiler alert I found it impossible to talk about Wuthering Heights without saying too much, so don t read ahead if you would prefer to know nothing about the book WHEN I Discovered This ClassicI have no idea Wuthering Heights would have been one of the first classics I ever heard about, surely Or perhaps I first heard Wuthering Heights by Kate Bush as a young child. But it was one that kept cropping up as a book I had to read.WHY I Chose to Read It It s a popular classic and the only one in the Goodreads top ten that I hadn t read. I received a lovely Penguin English Library edition through Caboodle. What I love about older classics is that I can switch between reading a physical copy and the eBook on my Kindle iPad. I started the eBook on my way back to London from Bath and enjoyed sharing quotes on Goodreads Wuthering Heights is the name of Mr. Heathcliff s dwelling. Wuthering being a significant provincial adjective, descriptive of the atmospheric tumult to which its station is exposed in stormy weather. WHAT Makes It A ClassicI expected Wuthering Heights to be a classic romance story about a young couple, Cathy and Heathcliff. I expected them to roam the Yorkshire moors, proclaiming their love for each other. But it s much more than that and I m not completely certain that it is a love story. Wuthering Heights has elements of a Gothic horror story. An intense story about revenge, betrayal, anger and jealousy, it s written in beautiful the prose that the Bront sisters are known for.I found Wuthering Heights confusing at first because we re introduced to a myriad of characters I suggest viewing a family tree, although it will give you spoilers. We then become familiar with the Earnshaws and the Lintons, two families caught up Cathy and Heathcliff s drama as well as their own conflicts. It s narrated mainly by Mr. Lockwood a tenant of Heathcliff s and Nelly a housekeeper who was close to both families . Even so, it was Cathy and Heathcliff that kept me reading and I understand why they re the most memorable part of the novel.WHAT I Thought of This ClassicBefore you ask, if I had to pick, I d choose Jane Eyre, one of my favourite classics so far and I probably should have rated it 5 rather than 4 . I also need to read Samantha Ellis How to Be a Herione , which particularly focuses on Catherine Earnshaw and Jane Eyre.I expected a lot from Wuthering Heights and was pleasantly surprised it s full of awful characters that I couldn t tear my eyes away from and conflicts that were both terrible and exciting. I wasn t prepared for the amount of mental and physical cruelty I didn t know that the book began with Mr. Lockwood and that we wouldn t get to hear directly from Catherine and Heathcliff. I didn t know that the book was split into two parts Nelly s flashbacks to the story of Catherine and Heathcliff and then the present day, about 18 years later. I am baffled as to why people envy Cathy and Heathcliff s relationship, but it was certainly an enjoyable one to read about I adored the drama and Catherine s fiery personality.Even though the second part of the novel wasn t as enjoyable for me, I liked discovering that Wuthering Heights was more complicated than expected and that this troublesome story and cast of vivid characters finally came full circle. As it is titled Wuthering Heights, it doesn t surprise me now to realise it s really a story of Heathcliff s life and transformation from the damaged young boy in his childhood to his eventual death in his late thirties, as master of Wuthering Heights. It would degrade me to marry Heathcliff now so he shall never know how I love him and that, not because he s handsome, Nelly, but because he s more myself than I am. WILL It Stay A ClassicI expect so because the story of Cathy and Heathcliff continues to draw people in, although they re only part of the story. WHO I d Recommend It ToPeople who enjoyed Jane Eyre and want to read another classic Bront story. People who are curious about Cathy and Heathcliff but are prepared to experience much more. People who enjoy intense drama My love for Linton is like the foliage in the woods time will change it, I m well aware, as winter changes the trees. My love for Heathcliff resembles the eternal rocks beneath a source of little visible delight, but necessary. Nelly, I am Heathcliff I also reviewed this book over on Pretty Books. "
"31","Wuthering Heights"," 28, 2008 Samantha","did not like it"," This review has been hidden because it contains spoilers. To view it, click here. This wasn t on my preordained Summer Reading Program list. It s an extra one, one I picked up from work a couple weeks ago after finishing Jane Eyre and thought I should give it another try. I write another because I supposedly read this in Junior High, but really just listened in class and skimmed Cliffs Notes. I remember hating most of what Mrs. Edmondson made us read, especially The Scarlet Letter, but that s neither here nor now.Wuthering Heights has been touted as a classic romance and He This wasn t on my preordained Summer Reading Program list. It s an extra one, one I picked up from work a couple weeks ago after finishing Jane Eyre and thought I should give it another try. I write another because I supposedly read this in Junior High, but really just listened in class and skimmed Cliffs Notes. I remember hating most of what Mrs. Edmondson made us read, especially The Scarlet Letter, but that s neither here nor now.Wuthering Heights has been touted as a classic romance and Heathcliff How many of us have left High School believing him to be some tragic romantic hero He was an asshole There were less than a handful of moments when I sympathized with the character when he was mocked by the Linton kids in childhood when he held Cathy in her chair, damning Linton to come in and see them , but for the most part I hated him. I was not attracted to him I thought he caused all the pain for himself and DESERVED to be haunted How can this be considered a love story Seriously Jane Eyre was better written by far and did not take long for me to swoon over Mr. Rochester, but Emily s book just fell short. I feel sorry for Charlotte, since I think more students are forced to study Wuthering Heights rather than Jane Eyre. I digress...I empathized most with Hareton, pronounced on the cd as Hayton the son of Edgar Linton who was raised by Heathcliff. Raised , more like abused His character was the only one that stood out for me as being more than caricature. He s the real tragic hero, in my opinion. And I m glad he got a happy ending. The ending is what made the book worthwhile, but still falls short when compared to other classics .In short, this book was a beating. "
"32","Wuthering Heights"," 26, 2016 Matt","really liked it"," When my book club picked Wuthering Heights, I had the vaguest of notions of what it was about. A romance in the moors, I thought. I recalled a movie trailer from the past, people standing in the rain, staring at each other with smoldering eyes people standing in the fog, staring at each other with smoldering eyes people staring at each other, staring, staring, staring. Also a snippet of dialogue popped into my head, overwrought and purple, the twist of phrase that sends teenage lit nerds into paroxysms My love for Linton is like the foliage in the woods time will change it, I m well aware, as winter changes the trees. My love for Heathcliff resembles the eternal rocks beneath a source of little visible delight, but necessary. Nelly, I am Heathcliff He s always, always in my mind not as a pleasure, any more than I am always a pleasure to myself, but as my own being. My book club is composed of six guys. We started the book club because we were tired of our wives having all the fun and drinking all the wine at their own gatherings. After our second time cycling through the club, with each member picking a book, Adam s wife pointed out that we d yet to read a female author. Adam decided to remedy this by picking Wuthering Heights, which had struck some kind of chord with him in high school. Based on my recollections, as noted above, I wasn t particularly looking forward to it. I believed in romance once, a long time and two kids ago, but it s hard for me to get excited about notions of love resembling the eternal rocks. Lucky for me, this isn t anything like a typical love story. Wuthering Heights is set in the bleak, chilly, forlorn Yorkshire moors. The story begins in needlessly complicated fashion with the new tenant of Thrushcross Grange, a man named Lockwood who narrates in the first person going to meet his landlord Heathcliff, who lives at Wuthering Heights. Lockwood is taken aback at the odd characters he meets at the Heights the rude, taciturn Heathcliff a young woman and a strange young man who appears to be a servant. There is a snowstorm and Lockwood is forced to spend an uncomfortable, nightmare ridden night at Wuthering Heights. When Lockwood returns to Thrushcross Grange, he asks his housekeeper, Nelly Dean, about the strange goings on at the Heights. At this point, Nelly takes over the first person narration to tell the bulk of the story. In other words, this is a Conrad esque nested narrative, where there are stories within stories within stories. Frankly, I find this literary technique irritating and confusing. Just use the third person It s much more believable Nelly s sprawling tale begins as a love affair between Heathcliff and Catherine Earnshaw. It was Catherine s father who came upon the homeless Heathcliff while on a trip to Liverpool. He brought Heathcliff back to Wuthering Heights to live with him, Catherine, and Catherine s brother Hindley. Heathcliff and Hindley don t like each other, but Catherine and Heathcliff do. A neighbor named Edgar Linton joins this crowd, wooing Catherine. At some point, Heathcliff runs off, Edgar marries Catherine, Heathcliff returns, and the melodrama begins At this point, I m going to stop with the plot points. For one, I m not SparkNotes, or CliffsNotes, if you re of a certain age and no, I won t help you write your term paper . For another, I can t keep the convolutions straight myself. This is a tangled book, filled with characters who are similarly named Heathcliff and Hareton, Lindley and Linton, Catherine and Cathy . Suffice to say, there are EMOTIONS involved. Very strong emotions. As in character in a Russian novel strong. Wuthering Heights is one of those Romantic novels in which spiritual or emotional illness will manifest into a physical illness that can literally kill you. My initial emotion, since we re on the topic, was one of dislike. I didn t like Wuthering Heights. I did not like the long, tedious introductory chapters narrated by Lockwood. I did not like the characters who all with the exception of the saintly Nelly Dean came across as either cruel, stupid, or both. I hated the character of Joseph, an old coot with a religious bent who speaks in an indecipherable colloquial dialect. At first, I used the annotations at the back of my Penguin edition to translate Joseph s mutterings. Eventually, up against a book club deadline, I started skipping everything he said . I did not care for the hyper passionate dialogue, or the occasionally murky prose. The more I thought about it, though, the more I came to respect Wuthering Heights. It is exceptionally sinister, with long sections of the story an epic mind f k coordinated by a vengeful Heathcliff. It is psychologically dark, if not especially deep. It is a work of fiction that demands discussion, and explodes with dozens of meanings depending on who is doing the reading. No one will ever know what Emily Bronte intended when she wrote Wuthering Heights. She died shortly after publication, and due to her gender, and her famous sisters, it was sometimes hard to convince people she even wrote it. Regardless, it is a work of imaginative genius. I ve always loved reading but I ve always hated being told what to read. It s my only real authority issues. Even in book club I sometimes get sulky and resentful when certain titles are chosen. I trace this issue back to all my English classes, and all the turgid classics I ve been assigned throughout the years. When I finally finished my last class in a pedagogical era that lasted twenty years, the first thought I had was I can read whatever I want True story after I finished the bar exam, most of my classmates gathered for an epic drunk. I stayed home and fulfilled my dream of reading a book while eating Pizza Hut pizza . Every once in awhile, I d try to throw a classic into my reading list, mainly for that sense of intellectual superiority that comes with being highbrow, if only for a fleeting moment. The younger, mid twenties version of myself still felt a residual resentment. I d read something like Moby Dick and almost be angry at it. Angry at its difficulty angry that people thought it was so good, and kept saying so, when it was self evidently so ponderous and syntactically tortured. Now I m coming to realize the value in wrestling with a book. For the most part, I still value a certain level of clarity when I read, because reading is fundamentally about communication. But the older version of myself can appreciate that extracting the meaning of something is worthwhile in itself. So I fought with Wuthering Heights, and the battle ended as a draw. And unlike Moby Dick, Wuthering Heights did not end up in the fireplace. "
"33","Wuthering Heights"," 13, 2010 Ben","did not like it"," I stopped at page 42. I couldn t stand the writing. Not only was it difficult to decipher call me dumb if you must but sentences, even paragraphs, that could have been summed up with a few words were expounded upon pompously for pages. This is a shame, because I love dark love stories and that, along with what I had heard about this novel s strong character development, and its generally strong reputation made me think I d love it.But I can t take anymore of the prose, and I m too bored with ADD, and too distracted with lack of patience to continue.Just can t do it....MeeeYuck. "
"34","Wuthering Heights"," 22, 2011 K.D. Absolutely","it was amazing"," Emily Jane Bronte 1818 1848 wrote Wuthering Heights in 1845 1846. She was single. 28 years old. Never had a boyfriend. At 30, died alone refusing to see doctors. How could she have written an enthralling book about tragic yet endless love How was she able to give the right emotions to her characters if she had not experienced those Most novels are based, wholly or partly, on actual events. Some are inspired by dreams or illusions. Still others are re telling of earlier works. I searched entries in Google and I could not find where Emily Bronte got his inspiration for this novel aside from the place called Haworth, where Emily s father was perpetual curate and it was in these surroundings that the sisters Charlotte and Anne were also novelists like Emily literary gifts flourished. So it must be the place. We all know that for some novelist, the surroundings are important when they write their novels Wuthering Heights and Thrushcross Grange. These are the two estates that define the many contrasts that Bronte effectively used to heighten the beauty of this novel. The name of the novel comes from the Yorkshire manor on the moors on which the story centers as an adjective wuthering is a Yorkshire word referring to turbulent weather and heights denotes imposing structure like a tower or a building. On the other hand, grange means a building for storing grain a granary and trushcross seems to signify a place that is nurturing, serene and peaceful. This primary contrast seems to perpetuate the many others that the novel has The Earnshaw family Mr. Mrs. Earnshaw, their son Hindley, their daughter Catherine and their adopted son, Heathcliff who lives in the Wuthering Heights are also people who are hateful, vengeful and cunning in contrast with the Linton family Mr. Mrs. Linton, their son Edgar and their daughter Isabella.Catherine loves Heathcliff but Hindley despises him. So, Catherine marries Edgar. Heathcliff goes away and when he returns he is already filthy rich so he works on his revenge. Catherine dies after giving birth to her daughter, the young Catherine. The she dies but in her deathbed, Heathcliff curses her to haunt him as long as he lives. Heathcliff marries Isabella who bears him a son, Linton and Heathcliff wants Catherine and Linton to marry each other because he hates his son as he still loves the dead Catherine. When Edgar dies, Heathcliff tells the gravedigger to dig the older Catherine s grave and when Heathcliff sees that her corpse does not decompose yet, he says that Catherine is waiting for his death for them to their dusts to mingle and decompose together.True love. Eternal love. Love that turns into obsession is the main theme of this novel and even if the characters especially but not limited to Heathcliff exhibit all the hate and anger that permeates the bulk of the story, you cannot help but emphatize with them. After all the hardships and early deaths due to sickness which must be due to loneliness and grief, still when you think about it, this is the same situation as Shakespeare s doomed lovers, Romeo and Juliet. The love that Catherine and Heathcliff have for each other was not allowed to prosper and it led to hate, misery and carried over even to the next generation of their families. It is a sad tragic love story that has withstood the test of time. It is a classic work that has been read by many generations and still to be read by future ones.I have no other rating for this book except 5 stars. "
"35","Wuthering Heights"," 26, 2013 Barry Pierce","liked it"," I hated everyone. I mean how can you like anyone in this novel People say Nelly Dean is a nice character but we don t know anything about her past She is the most unreliable narrator in the history of fiction I ve heard people say this is a love story. Well, I don t think they actually read this novel. If tormented souls literally digging up corpses of loved ones is your idea of love then you are probably Dexter or someone. I don t even know how to review this. Near the end I had to take it chapter by chapter. It was SO depressing I couldn t even stand it I read a chapter, then watched Clueless, read a chapter, then watched Labyrinth, read a chapter, then watched Romy and Michele s High School Reunion, I needed to flush each chapter out with teen comedies DO NOT read this book if you are in any way depressed or sad about something because it will drive you mental and you ll end up like Heathcliff. Even though I hated everyone and everything was so depressing, I still loved it. It s not up there with her sister s work Jane Eyre but it s not as boring as Pride and Prejudice . "
"36","Wuthering Heights"," 07, 2016 Fernando","it was amazing"," HP Lovecraft ubicaba este libro entre los mejores del g nero del terror. Para l, el hecho de que Heathcliff profanara dos veces la tumba de Catalina era tremendo. Tambi n nos da una idea del punto sin retorno al que el amor nos puede llevar.Esta historia tuvo caracter sticas emblem tica, poderosa y revolucionaria para la poca en que se escribi . Emily Bront solamente escribi este libro, pero adquiri su gloria eterna al relatarnos una tormentosa e inolvidable historia de amor que sale de todos los c nones rom nticos posibles y que elegir a antes que cualquiera de Jane Austen. "
"37","Wuthering Heights"," 19, 2008 J","it was amazing"," When one thinks of books of the past, one typically thinks that today s novels and entertainments are far more violent and vicious. There is a tendency to think of our own generation or the one or two immediately preceding ours as having invented sexual perversions, brutal literature, and genre bending and mixing. No one truly believes this intently, but it is a kind of humming substratum to our lives. That previous ages were simpler and more innocent and better and more pure and wholesome is not only a nostalgic commonplace, but it also one of the traditional props to conservatism. Back when I was a kid is a statement denoting how old you ve become and is either followed with things were a lot more etc. or we never etc. The first few pages of Wuthering Heights must surely disabuse of anyone of this notion of the good old days. We are introduced to Mr. Lockwood, a young man in retirement from some private sorrow, who ends up at Thrushcross Grange. Upon visiting the home of his landlord, the famed Mr. Heathcliff, he is set upon by a dog, Heathcliff abuses both him and all of his servants, Joseph, Hareton Earnshaw who is also Heathcliff s nephew , and his own daughter in law. What unfolds is a tale of madness, revenge, rage, and abuse that puts many a melodramatic serial killer novel of today to shame for the sheer vituperrious spite.And as the book progresses, Emily Bront shows herself no slouch in putting plain savagery and abomination on the page. Catherine, the young sister of the adopted Heathcliff, with whom he falls in love, as just a teenage girl slaps a servant, beats a small baby, then turns on her cousin Edgar Linton and boxes his ear. Her older brother, Hindley, gets drunk and attacks everyone, plays with his rifle, abuses his child, and tries to shove a carving knife down his servant s throat. Isabelle Linton, the sister of Edgar and Heathcliff s later wife , on being held by Catherine, sinks her fingernails into the woman s arm. After her departure, Catherine tells Heathcliff that such nails would dart for his eyes to this he promises he d wrench them off her fingers should she even try. When a boy, Hareton throws a rock at his nurse and damns her when he first sees her after many years.All in all, the book is a primer on the vicious circle that is revenge and hatred. One can easily imagine, while reading this book, all the characters in a circle, everyone beating the person first in front of him or her and being beaten by the one behind in turn. And so it turns, on and on. If literature of that time was generally expected to demonstrate some kind of moral, Wuthering Heights demonstrates it in the inverse.What sets everything in motion is the maltreatment of the found orphan, Heathcliff which starts from the very beginning with everyone calling him an it. His ferocious revenge is, while truly awful in all senses of the word, such a profound manifestation of hatred against everything, against the entire world, himself included, that he rises or is it sinks to the level of supreme tragic hero. He is like a Samson destroying the temple with his own soul within it. Emily Bront is remarkably less sympathetic to Catherine, with whom she deals rather sternly whereas Heathcliff gets the backlit, shadowy, windswept fen romanticism. She is Frankenstein, while he is Shelley s monster, a tortured agent of vengeance.What is amusing about this kind of novel, amusing for literally dozens of novels of the nineteenth century, is the level of suspension of disbelief the mechanics of the book require. Firstly, there is the narrator himself, Mr. Lockwood, Heathcliff s tenant, who tells the story of being told the tale by Ellen Dean, the nurse who witnessed most events and tells it in a pastiche of letters, personal recollections, gossip told to her, and other such secondary type narrative devices. It is a story about a story about various stories. And we are to accept Ellen having such a detailed memory as well as Mr. Lockwood.This is something we simply overlook after a certain point that we disregard that we overlook it is rather interesting and a stirring testimonial to Emily Bront s skill as a novelist. That this should be her only novel is a powerful statement to its lasting fame and a melancholy fact that such writing should be confined solely between two covers and no more. I never finish Wuthering Heights but wish there were a second Emily Bront novel to read. Alas for the tuberculosis that ravished the family at least three of the sisters died from it, and there is conflicting evidence that it killed the remaining sister and the only brother . That Emily had two sisters who were also novelists is scant consolation, no matter how enjoyable their novels may be. That she died at just thirty is as tragic as Keats death at twenty five. That the Oxford English Dictionary to this day doesn t recognize and define wuthering is a shame in and of itself. "
