"","book","reviewer","rating","review"
"127","Wuthering Heights"," 16, 2015 Anne","liked it"," This book drove me insane. It was such a wild, tumultuous roller coaster of rollicking emotions that I am left here at the end with an odd sense that my life is missing some drama . That, and the reassurance that if at some point during my existence I feared I did not have all my reason, there is now no doubt at all that there is nothing the matter with me or my senses. I am perfectly sane. Or I was, until I read this. Part of me hates this book to its very core. My half that has a penchant for all things sweet, romantic and sunny, and who delights in gentle romances where the characters do nothing but sip afternoon tea, exchange witty remarks and go to balls in extravagant clothing, highly disliked this novel. There was so much bitterness. So much hate. So much corruption. So much misery. Almost all the characters are detestable. The hero , Heathcliff, is anything but a hero, and I don t think anyone could sincerely read this book and think Wow. I want a love story like Catherine and Heathcliff . Their love for each other only served to drive them mad, as well as me and every other character in the story. I don t think I shall ever understand why Heathcliff never fought for Catherine while there was time, and persuade her to marry him instead of Edgar Linton, instead of running away and staying God knows where for three whole years a fact which my practical self strongly disliked, since it made no sense and what he did during that time is never explained . It s beyond me. Catherine was an absolute madcap, and she was so passionate, wicked and horrible that I could not stand her one minute. view spoiler I was never gladder of a character s death than I was of hers hide spoiler I was strongly tempted to stop reading this half way through, because there was so much madness and violence and the whole story seemed to make no sense at all. It was horrible, and picking it up every evening to continue was a pain. I felt like I was losing brain cells. Be with me always take any form drive me mad only do not leave me in this abyss, where I cannot find you Oh, God it is unutterable I can not live without my life I can not live without my soul It s like this the whole time...good, in a way, but So. Crazy However I persevered, and once a few of the characters were out of the picture, it became a lot more bearable, and I actually enjoyed, to some extent, the latter half of this book. I preferred the second generation of characters much more than the first. That s where the second part of me, my more liberal minded half who can recognize and appreciate greatness, admits that Wuthering Heights does indeed have its merits. For one thing, Emily Bront write some passages about love that, if taken out of context, are truly beautiful. Whatever our souls are made of, his and mine are the same. This will always be one of my favourite quotes.The story is definitely poignant, and although Heathcliff was undoubtedly awful, she still succeeded in making me feel sorry for him by turns, before he d go off and do something horrible again. I recognize Bronte s genius and talents, and her ability to explore and examine the sufferings of the mind and heart, and the consequences of letting hate and revenge empower one. I did not find it enjoyable to read about it and squirmed each time Heathcliff or Hindley would hit someone , but it was a great book, in the sense that I found it very awe inspiring and powerful, but also horrid, shocking and awful at the same time.My emotions towards this book feel like the book itself tempestuous, torn, indecisive and stormy.Whether you love Wuthering Heights or not, I can guarantee it will make you feel strong emotions. This is definitely not a light, romantic book. It s a wild, all consuming and completely insane story. I have not broken your heart you have broken it and in breaking it, you have broken mine. Buddy read with Becca "
"128","Wuthering Heights"," 27, 2012 Jonathan","liked it"," This was a tale not of passion as much as obsession. Compared to other great classic romances this was no Pride and Prejudice in my eyes. I may prefer the fact that the prose of Emily Bront is more obviously passionate than that of Austen s but in terms of storyline, plot and characters Austen wins the battle easily for me.It was difficult to really like this novel. It was well devised, well plotted and well written but the characters were incredibly unlikeable. The men were all either brutes, simpletons or first class dandies and the women were either overly domineering manipulators or they tended to be cruel and spoiled. Only the narrator s appeared to possess any decent qualities and since this was not a didactic narrative such as The Great Gatsby I found it hard to enjoy a novel full of such selfish and spiteful characters. Personally I cannot enjoy a tragedy unless in the beginning the characters were likeable to begin with. When a tragedy like this exists I personally as the reader find myself cheering at the end the fact that it finally finished and the characters got the unhappy ending they deserved. It may sound cruel or callous of me but remember these are fictional characters and when they re created to be more shallow than any human being I just don t care enough about them.I once heard Heathcliff described as more smouldering and dashing than Mr Darcy. However the only thing I saw in Heathcliff was a devilish and beastly man view spoiler who ultimately killed Cathy. How is he meant to be a romantic hero when he killed the woman he loved The tale to me reads more that Heathcliff killed the one woman he lusted after. hide spoiler At least Mr Darcy did everything out of noble reasons. Heathcliff possessed no such nobility in my mind. I would even compare Cathy to Elizabeth Bennett. Elizabeth is a smart and self assured protagonist while Cathy must have been on the edge of insanity. She was capricious, conniving and vampiric. She was virtually dependent on the men around her to survive and she used them like a leech. I would have felt sorry for those men if Edgar wasn t such a baby and Heathcliff were not a devil.Ultimately this wasn t a tale of passion and romance as much as a study of insanity and obsession. And as such it became difficult to enjoy watching the tragic shortcomings and failings of men and women possessed and cursed by their own failings. Although to be fair the story does end with a redemptive quality. view spoiler But who s to say that that final relationship between Cathy and Hareton would survive hide spoiler "
"129","Wuthering Heights"," 19, 2011 indri juwono","it was amazing"," 2011 19 Seseorang yang tidak pernah dicintai, akan sulit untuk memahami bagaimana caranya mencintai. Heathcliff, tanpa nama belakang, ditemukan di pinggir jalanan London oleh Mr. Earnshaw, pemilik Wuthering Heights. Dibesarkan dengan kebencian keluarga Earnshaw terhadap dirinya, kecuali Mr. Earnshaw yang berumur pendek. Tumbuh bersama Catherine Earnshaw yang riang dan ketus, yang menjadikannya teman bermain, kenakalan anak kecil, seseorang yang ia tidak ingin kehilangan seumur hidupnya, ia jaga, ia jadikan belahan jiwanya, hidupnya. Sampai pada saat mereka tersesat ke Thrusscross Grange, dan membuat Catherine bertemu Linton, yang santun, dan bisa mengubah Catherine yang liar menjadi kalem, menjadi perempuan anggun, dan tidak terjangkau lagi oleh Heathcliff, bukan lagi teman yang bisa berkeliaran bersama lagi. Catherine jatuh cinta pada Linton, menikah dengannya, meninggalkan Heathcliff, tapi memendam rasa tak terungkap.Cinta Heathcliff pada Catherine yang begitu besar, namun sayang ia tidak tahu bagaimana cara mencinta. Obsesif, keinginan memiliki, menguasai, dendam, semua diatasnamakan cinta. Tidak hanya semasa remaja, bahkan seluruh hidupnya hanya memikirkan bagaimana untuk membalas sakit hatinya karena merasa dikhianati Catherine. Tidak sebentar, namun bertahun tahun, berusaha meraih kembali apa yang ia pikir seharusnya menjadi miliknya.Cinta memang menakutkan. Kadang ia bisa menjadi manis dan lembut. Menyenangkan, membuat bahagia, membuat muka berseri seri. Kadang ia memberi tangis, membuat sedih, bersungut sungut, cemburu, hingga marah tak terkendali.Cinta yang teramat dalam membuat posesif, ingin menguasai, bahkan membinasakan. Apa ini masih namanya cinta Apa ini sudah yang namanya nafsu Kalau dibilang antara cinta dan nafsu itu begitu tipis, hingga bisa dipertukarkan. Dicurangi, sehingga dianggap bisa menggantikan satu sama lain. Cinta yang demikian besar sehingga menghancurkan. Seperti menanam cinta yang berubah menjadi racun yang lama kelamaan akan menginfeksi diri sendiri juga. Terjerat bukan pada cinta sejati namun ambisi.Don t let your heart s desire become your heart s disease... my birthday gift from my twin birthday sister Mery Momo. bighug cerita ini yang menginspirasi bella swan s tale kah really better, though. "
"130","Wuthering Heights"," 19, 2007 MacK","it was ok"," This book was practically shoved into my hands by my boss. He loved it...then again...he also loved The Scarlet Letter, that probably should have been a tip off.I had seen the movie before I read the book and somehow came under the impression that it was a beautiful romance. Reading the book I m completely befuddled as to how I ever came away with that impression...unless of course the film is totally different from the novel.None of the characters are really sympathetic, and some are so irritatingly antagonistic towards eachother and completely unfounded prejudices handled without the slightest trace of Austen s humor that I found myself rooting for the complete destruction of Wuthering Hieghts the grange and everyone remotely associated with them both. I hadn t been that set against the heroes since I rooted for Leather Face in The Texas Chainsaw Massacre and yes, I believe I might be the first person to connect Leatherface to Heathcliff .I m not quite sure what others see in it, but I m willing to hear. "
"131","Wuthering Heights"," 05, 2016 Liz Fashionably Late","it was amazing"," This is freaking dynamite.You loved me then what right had you to leave me Because ... nothing God or satan could inflict would have parted us, you, of you own will, did it. I have not broken your heart you have broken it and in breaking it, you have broken mine. So much the worse for me that I am strong. Do I want to live What kind of living will it be when you oh God would you like to live with your soul in the grave I forgive what you have done to me. I love my murderer."
"132","Wuthering Heights"," 20, 2008 Heather","did not like it"," In yet another proof that I m a social deviant, I must confess that I am a woman and I hate this book. There, I feel better now.It seems that everyone I know loves it. My sister and I argue about it often. I just don t like the characters. They re all mean. They re all selfish. Their world is harsh and ugly and I don t want to hang out with them or read about them. It s depressing. I ve read it a few times trying to like it. So far it hasn t worked. I may try again in a few years. Or I may just chuck it and read Calvin Hobbes or The Far Side for a while. "
"133","Wuthering Heights"," 28, 2014 Joseph","it was amazing"," Read for enjoyment and not for review.It would degrade me to marry Heathcliff now so he shall never know how I love him and that not because he s handsome, Nelly, but because he s more myself than I am. Whatever our souls are made of, his and mine are the same, and Linton s is as different as a moonbeam from lightning, or frost from fire. Catherine, Chapter 9"
"134","Wuthering Heights"," 02, 2016 Claudia","it was amazing"," http amulherqueamalivros.blogs.sapo..."
"135","Wuthering Heights"," 18, 2016","liked it"," spoiler. . . . Mind you, , . . Yorkshire , York . Sheffield. , . Yorshire , , moors Ian Brady Myra Hindley , . . . , . , . , . , . . , , , . goodreads , , , . , . . , , , . , , , , , . , , . , . . , , . , , . . , . psycho. . , , . , , . ... .cherrybookreviews.wordpress.com "
"136","Wuthering Heights"," 23, 2008 Jody","it was amazing"," Published in 1847, WUTHERING HEIGHTS was not well received by the reading public, many of whom condemned it as sordid, vulgar, and unnatural and author Emily Bronte went to her grave in 1848 believing that her only novel was a failure. It was not until 1850, when WUTHERING HEIGHTS received a second printing with an introduction by Emily s sister Charlotte, that it attracted a wide readership. And from that point the reputation of the book has never looked back. Today it is widely recognized as one of the great novels of English literature. Even so, WUTHERING HEIGHTS continues to divide readers. It is not a pretty love story rather, it is swirling tale of largely unlikeable people caught up in obsessive love that turns to dark madness. It is cruel, violent, dark and brooding, and many people find it extremely unpleasant. And yet it possesses a grandeur of language and design, a sense of tremendous pity and great loss that sets it apart from virtually every other novel written. The novel is told in the form of an extended flashback. After a visit to his strange landlord, a newcomer to the area desires to know the history of the family which he receives from Nelly Deans, a servant who introduces us to the Earnshaw family who once resided in the house known as Wuthering Heights. It was once a cheerful place, but Old Earnshaw adopted a Gipsy child who he named Heathcliff. And Catherine, daughter of the house, found in him the perfect companion wild, rude, and as proud and cruel as she. But although Catherine loves him, even recognizes him as her soulmate, she cannot lower herself to marry so far below her social station. She instead marries another, and in so doing sets in motion an obsession that will destroy them all. WUTHERING HEIGHTS is a bit difficult to get into the opening chapters are so dark in their portrait of the end result of this obsessive love that they are somewhat off putting. But they feed into the flow of the work in a remarkable way, setting the stage for one of the most remarkable structures in all of literature, a story that circles upon itself in a series of repetitions as it plays out across two generations. Catherine and Heathcliff are equally remarkable, both vicious and cruel, and yet never able to shed their impossible love no matter how brutally one may wound the other. As the novel coils further into alcoholism, seduction, and one of the most elaborately imagined plans of revenge it gathers into a ghostly tone Heathcliff, driven to madness by a woman who is not there but who seems reflected in every part of his world dragging her corpse from the grave, hearing her calling to him from the moors, escalating his brutality not for the sake of brutality but so that her memory will never fade, so that she may never leave his mind until death itself. Yes, this is madness, insanity, and there is no peace this side of the grave or even beyond. It is a stunning novel, frightening, inexorable, unsettling, filled with unbridled passion that makes one cringe. Even if you do not like it, you should read it at least once and those who do like it will return to it again and again. "
"137","Wuthering Heights"," 28, 2016 Tatiana Khaykina","it was amazing"," This review has been hidden because it contains spoilers. To view it, click here. I ve just finished Wuthering Heights . It took me three days to read it, although, I can t say that I had much free time but still tried to use every free minute to read. The novel captured me from the first page and I simply couldn t put the book down. Maybe, the fact that I decided to read a book in Russian for a change made such an effect and impressed me so. I really started missing the beauty of my native language in books.Emily Bronte created the inimitable gloomy atmosphere with the help I ve just finished Wuthering Heights . It took me three days to read it, although, I can t say that I had much free time but still tried to use every free minute to read. The novel captured me from the first page and I simply couldn t put the book down. Maybe, the fact that I decided to read a book in Russian for a change made such an effect and impressed me so. I really started missing the beauty of my native language in books.Emily Bronte created the inimitable gloomy atmosphere with the help of descriptions of nature and personifications of it. The author coped with the goal perfectly. The dreary feeling of something supernatural never left me while reading.The theme of love is the main theme of the novel. In my opinion, love should make people kind and caring and not only towards the person you are in love with, but towards the whole world. But love is different, it can inspire to share happiness with other people and it can inspire to avenge. But it doesn t mean that Heathcliff s love for Catherine wasn t right or proper . That love was the strongest feeling he was able to share. Of course, his own way of loving is incomprehensible for normal people. The love story between two main characters was disconsolate and, nevertheless, I was glad to read an unusual love story.This was the second gothic novel that I ve read and I m totally in love with this genre Although, the book made me shiver with fear a few times, I m delighted with the way Heathcliff loved Cathy even when he acted like a beast. Such behaviour only emphasized his crazy demonic passion for Catherine. The theme of suffering is one of the main themes of the novel. All the characters suffered mentally or physically. And sometimes it seemed to me that Heathcliff enjoyed suffering.Heathcliff s character is attractive to me because I find it unpredictable and mysterious. After Catherine s death the revenge became the sense of his life and that made the plot interesting. Catherine and Heathcliff will remain in my memory as phantoms that haunt the moors forever. I had no doubt that Catherine s soul was always near Heathcliff and she finally took him away with her.Little Cathy and Hareton reminded Heathcliff about his relationship with the love of his life. Let me dream, that Cathy and Hareton lived happily together.In conclusion I d like to say that I m glad to discover a new genre of literature for me. "
"138","Wuthering Heights"," 28, 2016 Meags","liked it"," 2.5 StarsThat was unexpected. I guess I always assumed this classic was another all embracing, Austen esque type love story. I assumed there d be an intelligent and sassy heroine, who would ultimately get swept off her feet by a dashing, but reticent, male lead. I assumed there d be plenty of swoon worthy romantic gestures, and an eventual and earned happily ever after for the main couple.Boy, was I wrong. This was one despairing turn of events after another, and to be honest, I m not sure if there was a likeable character to be seen. view spoiler Although, I did have a soft spot for dear Hareton especially while he was being bullied by young Linton and young Catherine the snobbish asshats hide spoiler . So many despicable characters, doing despicable things. I absolutely loathed Catherine Earnshaw Linton the first , and although I initially cared for Heathcliff, that quickly changed as he got older and more cantankerous. There was a moment early on, when Cathy was professing her feelings regarding Heathcliff to Nelly her nurse view spoiler My great miseries in this world have been Heathcliff s miseries, and I watched and felt each from the beginning my great thought in living is himself. If all else perished, and he remained, I should still continue to be and if all else remained, and he were annihilated, the universe would turn to a mighty stranger I should not seem a part of it. hide spoiler and I thought, Hell yes This is going to be so fricken romantic , but much to my chagrin, that was about the last of any romance I witnessed herein. The whole disliking characters thing is where I struggle I really have trouble appreciating a story, regardless of how well it was written, when I despise everyone involved. It leads to a bit of a disconnect for me. However, I can still appreciate the complexities of Bronte s storytelling, considering both how young she was when she wrote this and the time period in which it was written. Gotta give props to her for that "
"139","Wuthering Heights"," 17, 2015 Andrei Tama","it was amazing"," Specificul englezesc al scriitoarei este vizibil n roman, paginile lui descriind conflictul l untric al unui personaj Heathcliff. El este un b iat g sit ca n Singur pe lume , doar c aici este adoptat de o familie din mica burghezie care, din pricina firii sale sihastrice nu reu e te s se integreze n noua familie. C nd am spus de specific englezesc, m am referit la o abordare englezeasc a conflictului interior , c ci la nem i i la ru i, spre exemplu, abordarea acestuia este cu totul diferit , mult mai profund i mult mai tragic . O s fac ulterior o recenzie pentru Lupul de stepa , roman al lui Hesse care trateaz , de asemenea, conflictul interior . nt mplarea face ca el s se ndr gosteasc de fiica tat lui s u adoptiv, Catherine, cu care de altfel petrece, n copil rie i n adolescen , clipe minunate. ns tot nt mplarea face ca aceastra frumoas fat s fie promis altuia de vi nobil , de asemenea i dorit totodat de el. Aflat n menghina unei cruciale i foarte grele alegeri, Catherine mama , moare, dar nu nainte de a las pe lume o fiic , un copil care avea s i mo teneasc numele mic. De aici i conflictul interior al s rmanului Heathcliff... Desigur, romanul are i o mic doz de misticism m rog, i spun a a deoarece apar pe acolo ni te fantome, dar rolul lor nu e altul dec t acela de a scoate i mai mult n eviden conflictul interior al personajului, c ci, la urm urmei, s ar fi putut ca acele vedenii s nu fie dec t rodul chinurilor sale .C t despre structurarea romanului, pot s spun c mi a pl cut enorm. Curge fluent. Toat t r enia e istorisit de o guvernant , la gurba sobei... Ei, eu p n acum c teva luni nu am tiut c Emily Bronte a fost de profesie guvernant dar nu bag m na n foc c romanul e inspirat din via a ei . Cum a putut crede cineva vreodat c cei care odihnesc n pacea p m ntului ar putea avea un somn tulburat Andrei Tama ,14 saptembrie 2015 "
"140","Wuthering Heights"," 28, 2013 K.M. Weiland","it was amazing"," It is easy to understand why Emily Bront s first and only novel was ill received upon its first publication. Perhaps the ultimate Gothic novel, Wuthering Heights is a far cry from the simple tale of ill starred lovers one might expect from the pen of a Bront . Dark, sordid, even vulgar at times, the story of anti hero Heathcliff a gypsy child adopted, but never accepted, by the Earnshaw family of Wuthering Heights teems with all the basest passions of mankind.Befriended only by the younger Earnshaw child, a girl named Catherine, Heathcliff grows to hate all those who dare tread upon him because of his low birth. He grows obsessively attached to the beautiful, wild spirited Catherine, and when her pride forces her to marry another rather than stoop to Heathcliff s own station in life, he begins plotting the grand revenge that will send all of them to their graves.Few if any likable characters populate this book. It is a tale of love, but it is not an uplifting tale. It is a story of cruelty, selfish passion, vengeance, and finally madness. Despite its depressing theme, however, Bront s exceptional writing raises it to the deservedly lofty height of a classic.Told mostly through the first person narration of housekeeper Ellen Dean, the story progresses through Heathcliff s tormented childhood, Catherine s marriage to Edgar Linton, Heathcliff s elaborate revenge against the child of Catherine and Edgar s marriage, and finally his strange departure from the world of the Heights. "
"141","Wuthering Heights"," 11, 2012 Amber Todoroff","did not like it"," I m curious to know if ever there were an another terrible book that had more heaps of undeserving praise. Several people have recommended this book to me, purporting it to be their absolute favorite. It leads me to question my friendship with them and if, indeed, they have ever read any other book. ANY. Other book. This book s plot is incredibly fatiguing. It is touted as a great, tragic romance. I spied no romance and the tragedy that I was supposed to feel for some of the character s deaths was smothered by my over all happiness that I would not have to read about them any more. Indeed, the biggest tragedy of all was the loss of those precious minutes I spent of my limited time on earth reading this absolute garbage. The only thing I gained was an immediate disdain for people listing this book among their favorites. If you are ever curious as to someone s intelligence or devotion when they tell you they love books, ask them how they feel about Wuthering Heights. If they say a word of positive, do yourself a favor and avoid them forever. There are many, many wonderful novels from the 19th century. This is not one of them. "
